"Post ID",Title,URLs,Categories
16,"Free Download Adobe Flash Player Full &#038; Latest Version",,
17,"Free Download Adobe Reader DC Full &#038; Latest Version",,
13,"Free Download AeroAdmin Full &#038; Latest Version",,
23,"Free Download Commandos 2 Men Of Courage Full Version",,
22,"Free Download Commandos 3 Destination Berlin Full Version",,
25,"Free Download Commandos Behind Enemy Lines Full Version",,
24,"Free Download Commandos Beyond The Call Of Duty Full Version",,
27,"Free Download Commandos Strike Force Full Version",,
11,"Free Download Counter Strike Source Full Version",,
6,"Free Download Dolphin Emulator Full Version",,
14,"Free Download GTA SanAnd Areas Multiplayer Full Version",,
8,"Free Download Hitman 1 Codename 47 Full Version",,
9,"Free Download Hitman 2 Silent Assassin Full Version",,
7,"Free Download Hitman 3 Contracts Full Version",,
10,"Free Download Hitman 4 Blood Money Full Version",,
20,"Free Download IGI 1 Full Version",,
21,"Free Download IGI 2 Convert Strike Full Version",,
28,"Free Download Internet Download Manager Latest (Not Cracked) Version",,
26,"Free Download Midtown Madness Full Version",,
19,"Free Download Mirror Magic Full Version",,
18,"Free Download Mortal Kombat Deadly Alliance Full Version",,
30,"Free Download Motocross Madness 2 Full Version",,
29,"Free Download Skype Latest Version",,
12,"Free Download Taken Tag Tournament Full Version",,
15,"Free Download TeamViewer Full &#038; Latest Version",,
1,"Hello world!",,
2,"Sample Page",,
